{
  "report_metadata": {
    "report_id": "RSR-2026-0001",
    "generated_at": "2026-06-13T10:03:00+08:00",
    "agent_version": "rule_based_v1",
    "workflow_run_id": "WF-2026-0001",
    "data_sources": [
      "bright_data",
      "news_site",
      "search_engine"
    ]
  },
  "subject": {
    "subject_type": "organization",
    "primary_name": "Orion-linked operating unit",
    "aliases": [],
    "country": "Singapore",
    "industry": null,
    "known_associations": [
      "Orion-linked entity"
    ],
    "input_notes": null
  },
  "screening_scope": {
    "jurisdictions": [
      "Singapore"
    ],
    "languages": [
      "en"
    ],
    "lookback_period_years": 5,
    "search_queries": [
      "Orion-linked operating unit customs authorities shipping paperwork",
      "Orion-linked entity trade documentation inconsistencies",
      "Orion-linked operating unit regulatory adverse media"
    ],
    "screening_limitations": [
      "Specialist subscription databases were not searched."
    ]
  },
  "rubric_definition": {
    "rubric_version": "rule_based_v1",
    "component_scales": {
      "entity_match": [
        "low",
        "medium",
        "high"
      ],
      "source_tier": [
        "tier_1",
        "tier_2",
        "tier_3"
      ],
      "adverse_severity": [
        "low",
        "medium",
        "high",
        "critical"
      ],
      "recency": [
        "stale",
        "recent",
        "current"
      ],
      "jurisdiction_relevance": [
        "low",
        "medium",
        "high"
      ],
      "corroboration": [
        "none",
        "single_source",
        "multi_source"
      ],
      "case_linkage": [
        "low",
        "medium",
        "high"
      ]
    },
    "support_band_rules": [
      "EVIDENCE_HIGH_01"
    ],
    "case_risk_rules": [
      "CASE_MEDIUM_01: at least one medium_or_high_support finding in a material category",
      "CASE_ESCALATE_01: regulatory finding requires manual compliance review"
    ]
  },
  "assessment": {
    "overall_risk_level": "medium",
    "overall_summary": "Credible public-source regulatory concerns were identified and should be reviewed by compliance before onboarding proceeds.",
    "coverage_assessment": "moderate",
    "coverage_notes": "Open-web coverage is sufficient for initial review but specialist subscription databases were not searched.",
    "recommended_disposition": "escalate_to_compliance",
    "disposition_rationale": "At least one medium-to-high support adverse finding was identified in a material category.",
    "determination_basis": {
      "method": "rule_based_v1",
      "support_summary": {
        "high_support_evidence_count": 1,
        "medium_support_evidence_count": 1,
        "low_support_evidence_count": 0,
        "material_category_count": 2,
        "official_or_tier_1_hits": 0
      },
      "triggered_rules": [
        "CASE_MEDIUM_01: at least one medium_or_high_support finding in a material category",
        "CASE_ESCALATE_01: regulatory finding requires manual compliance review"
      ]
    }
  },
  "risk_flags": [
    {
      "flag_id": "RF-101",
      "category": "regulatory",
      "severity": "high",
      "title": "Customs authorities review shipping paperwork at Orion-linked entity",
      "description": "Authorities were reported to be reviewing inconsistencies in trade documentation at an Orion-linked operating unit.",
      "status": "needs_review",
      "evidence_ids": [
        "EV-101"
      ],
      "analyst_note": null
    },
    {
      "flag_id": "RF-102",
      "category": "adverse_media",
      "severity": "high",
      "title": "Customs authorities review shipping paperwork at Orion-linked entity",
      "description": "Authorities were reported to be reviewing inconsistencies in trade documentation at an Orion-linked operating unit.",
      "status": "needs_review",
      "evidence_ids": [
        "EV-101"
      ],
      "analyst_note": null
    }
  ],
  "evidence": [
    {
      "evidence_id": "EV-101",
      "source_type": "news",
      "source_name": "Asia Trade Monitor",
      "title": "Customs authorities review shipping paperwork at Orion-linked entity",
      "url": "https://example.com/article",
      "publication_date": "2025-11-02",
      "snippet": "Authorities were reported to be reviewing inconsistencies in trade documentation at an Orion-linked operating unit.",
      "language": "en",
      "risk_categories": [
        "regulatory",
        "adverse_media"
      ],
      "rubric_assessment": {
        "entity_match": "high",
        "source_tier": "tier_2",
        "adverse_severity": "high",
        "recency": "current",
        "jurisdiction_relevance": "high",
        "corroboration": "single_source",
        "case_linkage": "high",
        "justification": "The entity match is strong due to exact entity naming and jurisdiction alignment. The source is an established trade publication, and the issue is material to trade-finance risk."
      },
      "support_band": "high",
      "support_rule_triggered": "EVIDENCE_HIGH_01",
      "is_adverse": true
    }
  ],
  "analyst_checklist": [
    {
      "item_id": "AC-101",
      "action": "Review public-source regulatory concerns before onboarding proceeds.",
      "priority": "high",
      "reason": "At least one medium-to-high support adverse finding was identified in a material category.",
      "status": "pending"
    },
    {
      "item_id": "AC-102",
      "action": "Review specialist subscription databases.",
      "priority": "medium",
      "reason": "Specialist subscription databases were not searched.",
      "status": "pending"
    }
  ],
  "audit_trail": {
    "total_sources_reviewed": 1,
    "total_evidence_items_retained": 1,
    "false_positive_notes": [],
    "processing_notes": [
      "Open-web coverage is sufficient for initial review but specialist subscription databases were not searched.",
      "CASE_MEDIUM_01: at least one medium_or_high_support finding in a material category",
      "CASE_ESCALATE_01: regulatory finding requires manual compliance review"
    ]
  }
}
